<?xml version="1.0" encoding="UTF-8"?>
<list xmlns:xsi="http://www.w3.org/2001/XMLSchema-instance" xsi:noNamespaceSchemaLocation="../../xsd/quests.xsd">
	<quest id="39" nameEn="Red-Eyed Invaders" nameRu="Красноглазые захватчики">
		<droplist>
			<npc id="20919">
				<item id="7178" min="1" chance="60" rateable="true" /> <!--Black Bone Necklace-->
			</npc>
			<npc id="20920">
				<item id="7178" min="1" chance="60" rateable="true" /> <!--Black Bone Necklace-->
				<item id="7180" min="1" chance="60" rateable="true" /> <!--Incense Pouch-->
			</npc>
			<npc id="20921">
				<item id="7179" min="1" chance="60" rateable="true" /> <!--Red Bone Necklace-->
				<item id="7180" min="1" chance="60" rateable="true" /> <!--Incense Pouch-->
			</npc>
			<npc id="20925">
				<item id="7181" min="1" chance="60" rateable="true" /> <!--Gem of Maille Lizardman-->
			</npc>
		</droplist>
		<rewardlist>
			<item id="6521" min="60" rateable="true" /> <!--Green Colored Lure-->
			<item id="6529" min="1" rateable="false" /> <!--Baby Duck Rod-->
			<item id="6535" min="500" rateable="true" /> <!--Fishing Shot (No-Grade)-->
		</rewardlist>
	</quest>
</list>