<?xml version="1.0" encoding="UTF-8"?>
<list xmlns:xsi="http://www.w3.org/2001/XMLSchema-instance" xsi:noNamespaceSchemaLocation="../../xsd/quests.xsd">
	<quest id="663" nameEn="Seductive Whispers" nameRu="Обольщающий шепот">
		<level min="50" max="85" />
		<droplist>
			<npc id="20674">
				<item id="8766" min="1" chance="80" rateable="true" /> <!--Spirit Bead-->
			</npc>
			<npc id="20678">
				<item id="8766" min="1" chance="80" rateable="true" /> <!--Spirit Bead-->
			</npc>
			<npc id="20954">
				<item id="8766" min="1" chance="80" rateable="true" /> <!--Spirit Bead-->
			</npc>
			<npc id="20955">
				<item id="8766" min="1" chance="80" rateable="true" /> <!--Spirit Bead-->
			</npc>
			<npc id="20956">
				<item id="8766" min="1" chance="80" rateable="true" /> <!--Spirit Bead-->
			</npc>
			<npc id="20957">
				<item id="8766" min="1" chance="80" rateable="true" /> <!--Spirit Bead-->
			</npc>
			<npc id="20958">
				<item id="8766" min="1" chance="80" rateable="true" /> <!--Spirit Bead-->
			</npc>
			<npc id="20959">
				<item id="8766" min="1" chance="80" rateable="true" /> <!--Spirit Bead-->
			</npc>
			<npc id="20960">
				<item id="8766" min="1" chance="80" rateable="true" /> <!--Spirit Bead-->
			</npc>
			<npc id="20961">
				<item id="8766" min="1" chance="80" rateable="true" /> <!--Spirit Bead-->
			</npc>
			<npc id="20962">
				<item id="8766" min="1" chance="80" rateable="true" /> <!--Spirit Bead-->
			</npc>
			<npc id="20974">
				<item id="8766" min="1" chance="80" rateable="true" /> <!--Spirit Bead-->
			</npc>
			<npc id="20975">
				<item id="8766" min="1" chance="80" rateable="true" /> <!--Spirit Bead-->
			</npc>
			<npc id="20976">
				<item id="8766" min="1" chance="80" rateable="true" /> <!--Spirit Bead-->
			</npc>
			<npc id="20996">
				<item id="8766" min="1" chance="80" rateable="true" /> <!--Spirit Bead-->
			</npc>
			<npc id="20997">
				<item id="8766" min="1" chance="80" rateable="true" /> <!--Spirit Bead-->
			</npc>
			<npc id="20998">
				<item id="8766" min="1" chance="80" rateable="true" /> <!--Spirit Bead-->
			</npc>
			<npc id="20999">
				<item id="8766" min="1" chance="80" rateable="true" /> <!--Spirit Bead-->
			</npc>
			<npc id="21001">
				<item id="8766" min="1" chance="80" rateable="true" /> <!--Spirit Bead-->
			</npc>
			<npc id="21002">
				<item id="8766" min="1" chance="80" rateable="true" /> <!--Spirit Bead-->
			</npc>
			<npc id="21006">
				<item id="8766" min="1" chance="80" rateable="true" /> <!--Spirit Bead-->
			</npc>
			<npc id="21007">
				<item id="8766" min="1" chance="80" rateable="true" /> <!--Spirit Bead-->
			</npc>
			<npc id="21008">
				<item id="8766" min="1" chance="80" rateable="true" /> <!--Spirit Bead-->
			</npc>
			<npc id="21009">
				<item id="8766" min="1" chance="80" rateable="true" /> <!--Spirit Bead-->
			</npc>
			<npc id="21010">
				<item id="8766" min="1" chance="80" rateable="true" /> <!--Spirit Bead-->
			</npc>
		</droplist>
		<rewardlist>
			<variant id="1">
				<item id="57" min="40000" rateable="false" /> <!--Adena-->
			</variant>
			<variant id="2">
				<item id="57" min="80000" rateable="false" /> <!--Adena-->
			</variant>
			<variant id="3">
				<item id="57" min="110000" rateable="false" /> <!--Adena-->
				<item id="955" min="1" rateable="true" /> <!--Scroll: Enchant Weapon (D-Grade)-->
			</variant>
			<variant id="4">
				<item id="57" min="199000" rateable="false" /> <!--Adena-->
				<item id="951" min="1" rateable="true" /> <!--Scroll: Enchant Weapon (C-Grade)-->
			</variant>
			<variant id="5"> <!--Random reward-->
				<item id="4963" min="1" rateable="true" /> <!--Recipe: Great Sword (60%)-->
				<item id="4966" min="1" rateable="true" /> <!--Recipe: Keshanberk (60%)-->
				<item id="4967" min="1" rateable="true" /> <!--Recipe: Sword of Valhalla (60%)-->
				<item id="4968" min="1" rateable="true" /> <!--Recipe: Kris (60%)-->
				<item id="5001" min="1" rateable="true" /> <!--Recipe: Lance (60%)-->
				<item id="5003" min="1" rateable="true" /> <!--Recipe: Art of Battle Axe (60%)-->
				<item id="5004" min="1" rateable="true" /> <!--Recipe: Staff of Evil Spirits (60%)-->
				<item id="5005" min="1" rateable="true" /> <!--Recipe: Demon's Dagger (60%)-->
				<item id="5006" min="1" rateable="true" /> <!--Recipe: Bellion Cestus (60%)-->
				<item id="5007" min="1" rateable="true" /> <!--Recipe: Bow of Peril (60%)-->
			</variant>
			<variant id="6"> <!--Random reward-->
				<item id="4101" min="1" rateable="true" /> <!--Zubei's Shield Fragment-->
				<item id="4107" min="1" rateable="true" /> <!--Keshanberk Blade-->
				<item id="4108" min="1" rateable="true" /> <!--Sword of Valhalla Blade-->
				<item id="4109" min="1" rateable="true" /> <!--Kris Edge-->
				<item id="4115" min="1" rateable="true" /> <!--Lance Blade-->
				<item id="4117" min="1" rateable="true" /> <!--Art of Battle Axe Blade-->
				<item id="4118" min="1" rateable="true" /> <!--Evil Spirit Head-->
				<item id="4119" min="1" rateable="true" /> <!--Demon's Dagger Edge-->
				<item id="4120" min="1" rateable="true" /> <!--Bellion Cestus Edge-->
				<item id="4121" min="1" rateable="true" /> <!--Bow of Peril Shaft-->
			</variant>
			<variant id="7">
				<item id="57" min="1284000" rateable="false" /> <!--Adena-->
				<item id="947" min="2" rateable="true" /> <!--Scroll: Enchant Weapon (B-Grade)-->
				<item id="948" min="2" rateable="true" /> <!--Scroll: Enchant Armor (B-Grade)-->
			</variant>
			<variant id="8">
				<item id="57" min="2384000" rateable="false" /> <!--Adena-->
				<item id="729" min="1" rateable="true" /> <!--Scroll: Enchant Weapon (A-Grade)-->
				<item id="730" min="2" rateable="true" /> <!--Scroll: Enchant Armor (A-Grade)-->
			</variant>
			<variant id="9"> <!--Reward with 6 variant-->
				<item id="57" min="675000" rateable="false" /> <!--Adena-->
			</variant>
			<variant id="10"> <!--Reward with 5 variant-->
				<item id="57" min="388000" rateable="false" /> <!--Adena-->
			</variant>
		</rewardlist>
	</quest>
</list>